idx,cnt,review1,review2,review3,review4,review5,review6,review7,review8,review9,review10,review11,review12,review13,review14,review15,review16,review17,review18,review19,review20,review21,review22,review23,review24,review25,review26,review27,review28,review29,review30,review31,review32,review33,review34,review35,review36,review37,review38,review39,review40,review41,review42,review43,review44,review45,review46,review47,review48,review49,review50
71,50,사람 많아요. 기구 싸움 장난아닙니다. 그만큼 관리 잘되어 있어요.,헬스만 하고싶은 사람들한테도 피티 권유해서 부담스러움,굿,군자역 피티는 스포애니 김규정!!! 바프 찍고싶어서 무작정 찾아가서 상담받았었는데 피티 등록 전 상담임에도 인바디 측정 후 세세하게 잘 알려주셨습니다. 운동 플랜도 주기적으로 몸 상태에 맞춰 체계적으로 진행해주시고 식단 관리와 멘탈 케어까지 완전 잘 해주십니다. 덕분에 몸 상하는 일 없이 건강한 운동 잘 했습니다. 스포애니 군자점 김규정 팀장님 완전 물건입니다 ㅎㅎ 강력 추천이요!!!,굿,좋아요,좋아요,사람 많아유ㅠ,"스포애니에서 처음으로 피티 받아봤는데 받길 잘했다는 생각이 들었습니당! 저 담당해주신 보미쌤 너무너무 감사드려요!!?? 피티받기 전에 운동하는 자세가 잘못돼서 가르쳐주셨는데 어디가 어떻게 잘못됐는지 자세히 알려주셔서 피티까지 받게 됬는데용 하면할수록 제가 운동 느는게 느껴졌어여! 제가 개인사정상 헬스장을 꾸준히 못나가면서 막 2주, 길면 한달만에 본 적이 많았는데 항상 반갑게 맞이해주셔서 감사해용?? 운동하면서 중량늘릴때 할 수 있다고 해주시고 응원해주셔서 피티 받을 때마다 한계를 뛰어넘을 수 있었던거 같아여!>< 보미쌤이랑 피티받으면서 진짜 많은 운동 배웠어여! 쌤이랑 운동하면 지루하지않고 시간 진짜 빨리가는거 같았어여! 운동은 힘들지만 재밌었어여! 담에 기회된다면 또 쌤이랑 할래용! 감사했습니당?????",좋아요,"헬스한지얼마안되어서 자세잡기가 어려웠는데 친절하게 차근차근 잘알려주셨습니다
기존에 자세와 스트레칭해주어야하는 부분까지 잘 체크해주시고 근력운동시에 힘들어가는 부분이 어딘지 꼼꼼히 물어봐주시면서 진행해서 운동효과가 더좋은거같아요!!!","퇴근하면 열심히 술병만 들던 제가 덤벨/바벨을 들게 된 과정까지 함께 해주신 김태성 트레이너님??

요즘 Youtube나 미디어를 통해 운동을 쉽게 접할 수 있는 건 사실이지만 내가 갖고태어난 체형과 고착된 습관은 개인마다 천차만별이기에 영상시청만으로 운동을 배우는건 분명 한계점이 있죠.. 김태성 트레이너님은 이런 저의 고민을 완벽하게 해결해주셨습니다. 충분한 상담과 체형 분석을 통해 시간과 노력을 투자하면 결과로 나타나는 저만의 운동요령을 알려주셨고, 열심히 따라준 저의 몸은 거짓말하지 않았습니다. 작년 말부터 시작해서 이제는 옆에 서있으면 누가 트레이너인지 모를정도입니다?(너빼고 다알아) 운동 시작하는게 고민되시거나 운동을 하고있지만 결과로 나타나지않는다면 꼭 태성트레이너님께 상담 받아보시기 바랍니다??","자세도 잘 잡아주고, 나에게 맞는 운동도 잘 알려 줘서 근력운동에 관심 없었는데 흥미가 생겼습니다.",쏘쏘,"항상 헬스장 가면 기구사용법도 모르겠고, 런닝머신만 뛰다 집에 왔는데,
제대로 확실하게 운동을 배워보자 싶어서, 군자역 인근 헬스장을 여러군데 알아보다가, 스포애니 군자역점에서 헬스장 등록과 PT 등록을 하였습니다.
그렇게 스포애니 군자역점을 다닌지 곧 1년이 되어가네요.
김태성 트레이너님께서 저를 지도해 주셨습니다.
저에게 맞춰서 체계적으로 정확하게 알려주셨습니다.
작년에 비해 몸이 많이 좋아진 것이 느껴집니다.
몸이 좋아지니 전보다 자신감과 활기가 생겼습니다.
헬스장은 스포애니 군자역점, 트레이너는 김태성 트레이너!
추천 드립니다.","홈트만 하다가 처음으로 헬스를 해봤어요. 상담후에 김태성 트레이너님과 함께 하게되었는데 자세도 잘 봐주시고 틈틈이 이론이랑 운동 지식도 알려주셔서 굉장히 이해하기 쉬웠습니다!! 
어릴때부터 무릎이랑 팔꿈치가 많이 약했는데 운동하면서 트레이너님이 교정도 해주시고 특정 부위에 자극이 잘 갈수 있게 세세히 알려주셔서 나중에 개인 운동할때도 편했습니다 ^^ 모르는거 물어보면 항상 이해하기 쉽게 알려주시고 친절하십니다!! 처음하는데도 불구하고 재밌게 계속 할수 있어 최곱니다 ?????? 운동 처음하시는분들도 재밌게 할수 있게 김태성 트레이너님 추천합니다!! ^^","이재석 트레이너님이 운동도 잘 알려주시고 유쾌하게 가르쳐주셔서 헬응애인 저에게 재밌게 배웠습니다. 3층으로 되있어서 좋아요
시설도 넓고 깔끔해서 좋아요오오
단점이라면 사람이 많다는점?","저는 살면서 운동의 “ㅇ”도 모르고 살다가 이번 연도에 헬스장을 다녀 보겠다는 마음을 다 잡고 여러 헬스장을 찾던 중에 스포애니 군자점 문성인 트레이너님께 제 고민과 희망 사항을 말씀드렸는데 친절한 상담과 구체적인 커리큘럼을 알려주셔서 스포애니 군자점을 선택하게 되었습니다. 운동이 처음인 저에게 각 부위 별 운동 정보, 자세를 자세하게 알려주시고 옆에서 항상 응원을 해주셔서 현재는 몸무게도 늘고 운동에 대한 재미가 생겼습니다.?? 그리고 항상 제가 쳐지지 않게끔 옆에서 많이 도와주시고 힘을 주십니다!?? 항상 감사드리고 여러분!! 운동을 즐겁게! 활기차게! 하시려면 스포애니 군자점 “문성인 트레이너”를 강추합니다!!! (근데 이거 비밀인데.. 문성인 트레이너님.. 스포애니 군자점 미모 원!탑! 입니다.??)","이번에 처음 받아본 PT였는데 인터넷이나 유튜브에 나오는 흔한 운동법이 아닌 저에게 딱 맞는 운동방법과 호흡법을 유경수 트레이너 선생님께 배워 처음으로 꾸준히 운동하고 있습니다.
저처럼 헬스 끊어놓고 며칠 나가고 안나가시는 분들께 저를 끝까지 끌어주신 유경수 트레이너님을 추천합니다!!",우리 보미 헬스트레이너 선생님 ㅜㅜ 덕분에 제가 몸너무 탄탄해지고 건강미를 찾게되었어요..항상 개인 운동하면 유심히봐주시고 카톡으로 피드백해주시공ㅜㅜ pt받을때 세심하게 알려주셔서 운동 배우려는 목적으로 pt를 끊은 저에게 정말 도움이되었어요 선생님 과 함께하는 운동에 재미붙여서 10회만 하자고 끊었는데 어느새 30회를 끊고 운동에 대해 자세하게 알게되 혼자서도 잘 할수있게 되었어요! 그리고 저의 잘못된 생활습관으로 몸이 불균형이 왔는데 그거까지 케어를..이 리뷰 보시는 분들 pt생각하시면 보미선생님께 꼭 꼭 꼭 받으세요 ㅜㅜ 정말 짱이예요??????,군제대후 체계적인 운동법을 배우기위해 여러군데를 찾던중 김규정 트레이너님이 제일 체계적이고 친절하게 상담을 해주셔서 군자점을 선택하게 되었습니다 ????운동을 시작하게 된 후 정확한 자세로 부상의 위험을 줄여주셨고 다음 단계로 나아갈수 있는 근육량을 늘려주셨습니다 ????운동이 마냥 힘들고 어려운것이 아닌 즐겁고 누구나 쉽게 접근할수 있다는것을 깨닫게 해주셨습니다 ????또한 건강한 마음가짐 긍정적인 사고를 덤으로 얻어갈수 있었습니다 ??운동이 어렵거나 더 발전하고 싶으신 분들은 무조건 김규정 트레이너님을 추천합니다!!??????,좋아요,완전 좋아요 강추,최애 헬스장입니다. Gx 선생님들 다 너무 좋아요,"처음 받아보는 PT 라 걱정이 많았는데 김규정 트레이너님을 만나 체계적인 수업을 받았고 운동 하는 방법과 근육을 쓰는 방법을 배웠습니다.
작은 부분도 그냥 넘어가지 않고 친절하게 교정 해주셔서 어려움 없이 운동을 하고 있고 
운동 지식, 식단 뭐하나 빠짐 없어 알려주셔서 너무 기분 좋게 배우고 있습니다
너무 좋은 김규정 트레이너님을 만나 운동 하는 방법도 제대로 알게 되고 자신감도 함께 얻었습니다.
저 처럼 자신감을 가지고 싶으신 분들께 김규정 트레이너님 적극 추천 합니다!
다들 김규정 트레이너님 만나셔서 건강과 자신감 얻어 가세요!",제대로 몸 만들어보고 싶어서 무작정 찾아갔는데 정말 잘 왔다고 생갑합니다. 트레이너님도 체계적이고 꼼꼼하게 알려주시고 시설도 너무 좋아서 금방 이쁜 몸 만들 수 있을 것 같아요,"혼자 개인운동으로 몇 년 하다가 이번에 유경수 트레이너님께 지도를 받게 되었습니다. 자세 교정부터 식단관리, 여러면으로 디테일하게 알려주셨고, 트레이너님 특유의 긍정적인 마인드를 많이 주셔서 운동이 귀찮은데 해야 하는 것이 아니라 재미있는 시간을 보내는 것으로 바뀌게 되었습니다! 
운동은 해야 하는데 금방 질리거나 지루하신 분들은 유경수 트레이너님 추천드려요!",사람많아요,"이재석 트레이너님 진짜 쵝오에요??
헬스가 처음이라 운동에 관한 지식이라곤 1도 없었어요 기구 사용법은 커녕 런닝머신도 처음 올라가봤어요.. PT등록했는데 이재석쌤이 담당인게 신의 한수였습니다!!! 하나하나 이해하기 쉽게, 자세히 설명 해주시고 운동 자세도 잘 잡아주셔요. 저는 10회 받고 너무 좋아서 20회 추가등록 했어요ㅎㅎ 아는 지인도 소개해줘서 피티 등록했는데 만족하면서 배우고 저한테 고맙다고 하네요
인바디도 체형도 눈에 보이게 달라졌고, 무엇보다 운동이 넘 재밌습니다!! 의무였던게 취미가 되니까 뿌듯하고 행복하네요??","1월 초에 새마음 새뜻으로 건강관리를 하기위해 스포애니 군자지점에서 운동을 하게되었습니다
열심히 해보고자 유경수 트레이너분께 수업을 듣게 되었고
형식적인 트레이닝 방식이 아닌 사람으로써, 트레이너로써 진심을 다해서 가르쳐주신다는게 느껴져서 칭찬게시판 까지 왔네요
사회경험이 많아 이사람이 그냥 운동만 알려준다는 것과 진심으로 회원의 몸을 생각해서 같이 일상을 공유하며
적극적으로 서포트해주는 것의 차이를 알고있습니다
유경수 트레이너님은 트레이너 이전에 사람이 좋아 힘들지만 웃으며 보람되게 운동을 할 수 있게합니다
감사합니다ㅎㅎ 열심히 해서 몸으로 보답하겠습니다~!",아직안다녀봐서몰겠음,좋아요,"군자역점 유경수 트레이너님 추천합니다.
아무런 지식없이 유튜브만 보고 개인운동 하기에는
좀 어려움이 있는거같아 유경수 트레이너님께 PT를 받게되었는데 PT시간외 개인운동중에도 자세 많이 봐주시고 운동팁도 많이 주십니다. 성격도 좋으시고 친절하셔서 처음 운동 시작하시거나 PT가 필요할거같다 싶으신 분들께 추천드립니다.

시설도 좋고 운동기구들도 많습니다.",군자역에 이사오고 올해 바디프로필 목적으로 PT 상담 후 현재 진행중인데 과거에는 없던 새로운 모습이 매일 매일 만들어지는 기분입니다!,"군자역, 중곡역 헬스장은 한곳도 빠짐없이 다 돌아보고나서 스포애니를 마지막으로 방문했는데
PT팀장님께서 상담을 진짜 너무 잘해주셔서
가격 생각하지않고 제 생에 마지막 피티를 등록했어요! 
부담도 주지않으시고 첫 상담때부터 진짜 저를 친동생처럼 걱정해주시고 대해주는게 느껴져서 너무 감사했어요
그래서 가격 생각하지않고 30회나 먼저 끊고 
지금 추가로 20회를 더 끊었는데,
피티를 끊게되면 헬스장 이용료는 별도로 받지않으셔서 금액적인 부담도 그렇게 크지않았던 것 같아요!
그리고 체인점이라 여러 카드 무이자할부가 되서 넘 좋아요!! 그리고 팀장님 외에 다른쌤들도 너무 재밌고 편안하고 친절하세요 ㅠㅠ 전 결국 최고 몸무게에서 10kg 이상 감량했고 요즘 옷 입는게 행복해요 ㅠㅠ 다이어트, PT는 무조건 여깁니당?",시설이 너무 좋고 쾌적한 분위기에서 운동 할 수 있어서 좋습니다 ^^,좋아요,일단 다른곳보다는 더 저렴한가격에 퀄리티있는 운동기구들을보고 스포애니를 선택했는데 피티까지끊어보고 나니깐 스포애니 다니기를잘했다라는생각이들었어요~ 유경수 선생님께 피티를 받고있는데요! 정말친구처럼 마음편하게 운동할수있게끔 배려해주시고 친절하게 대해주셔서 요즘 너무재밌게 운동하고있어요~ 실력이면 실력 트레이너로서 회원을대하는 마음가짐은 물론이구요 잘못된자세나 어떻게해야더 효율적으로 운동을할수있는지를 알려주셔서 아주 만족하고있습니다. 다이어트나 골격근량이 고민이신분들은 스포애니 유경수선생님 한번 찾아보세요~ 후회하진 않으실거에요~~ 그럼 다들 득근하세욥,좋아요,좋아요,혼자 운동하기가 어려워서 피티를 알아보던 중 스포애니 군자점을 알게되었습니당 ! 우선 센터위치가 군자역에서 도보 5분 정도로 교통이 굉장히 편리하고 내부 시설도 유산소존이랑 웨이트존이 층으로 따로 구분되어있어서 좋았어요~~ 그리고 피티받으실꺼면 김규정 팀장님 완전 추천합니다!! 피티 등록전 상담도 되게 세부적으로 해주시고 구체적인 플랜을 짜주세요! 운동도 그날 그날 계획을 미리 짜오셔서 체계적으로 가르쳐주시고 시간도 꽉꽉 채워서 해주십니당!! 저는 요즘 유행하고있는 바프 찍고싶어서 트레이너님께 말씀드렸더니 운동뿐만아니라 식단까지 아주 디테일하게 잘 짜주시더라구요~~~ 덕분에 근손실없이 체지방만 건강하게 빼면서 촬영할 수 있었습니다ㅎㅎㅎ운동 제대로 해보고싶으시면 스포애니 군자점 김규정팀장님 강력 추천이여~~,"저렴해요 그래서 사람이 많아요 
기구 경쟁이 치열해요",저렴한데 사람이 많아요 ㅜ,굿,군자에 이런 헬스장이 있었다니ㅜㅜ 너무 편해요!! 규정쌤과 피티진행중인데 놓쳤던 부분도 체크 잘해주시고 요즘 운동이 너무 재밌어요!,최고!!,좋아요,좋아요,굿굿,"soso
저렴한거 같아 보이지만 회원비가 있어서
그렇게 싼편은 아님.
장기이용고객은 괜찮을듯! 
런닝 자전거 제외 기구들은 하나씩 밖에 없어서 붐비는 시간대에 기구전쟁....
코로나 시국이라 사람 그나마 없어서 괜찮고, 아니면 헬스장 터질듯...
그리고 화장실 하나밖에 없고,
샤워장 관리 안되서 물곰팡이 장난없음..."
72,0,,,,,,,,,,,,,,,,,,,,,,,,,,,,,,,,,,,,,,,,,,,,,,,,,,
73,36,모든 직원분들이 친절해요^^,여직원분 상담도 친절하게 해주시고 가격도 착해요~~!!,접근성도 좋고 편리하고 좋아요!,"시설도 좋고 다들 너무 친절해요~~
계속 재등록 해서 다니는데 정말 정말 좋아요~",3년째 이용중입니다. 편리하고 좋아요!,"비스코 토탈 휘트니스 너무 만족하며 다닙니다! 1년 다녔고 다시 1년 재등록했어요!! 친절한 데스크와 능력좋은 pt,골프선생님들 덕분에 기분좋게 운동 다니며 건강챙기고 있어요~!!",시설 깔끔해서 이용하기 편해요,웨이트와 골프를 함께 즐길 수 있어 좋아요!,상담을 너무 잘해주시고 집근처라 열심히 잘 다닐수 있을거같아요~! 시설도 깨끗하고 목욕시설에도 만족이에요!!!,위치가 좋고 이용할게 많아서 좋습니다,처음 방문했는데 시설도 좋고 할게 많아서 좋습니다,시설이 깨끗하고 주차가 편해요,지하철역도 가낍고 좋네요,"시설 깨끗하고 좋아요~
너무 마음에 들어요~",시설도 깔끔하고 골프치기도 너무좋아요 상담도 친절하고 운동도 잘가르쳐주셔서 열심히 다니고있어요,시설이. 깨끗해요,시설 깨끗하고 좋아요~,시설이 좋아요.,너무 좋아요,시설좋네요,"시설 깔끔하고 헬스 머신 종류별로 다양하게 있어서 운동하기 넘 좋았어요~~ 직원분들도 친절하시구^^
12층이라 런닝머신 탈때 한강쪽이 보여서 답답하지않아서 특히 좋았어요",테크노마트 12층이라 경치가 되게 좋네요~ 지하가 아니라 답답하지않고 야경이 정말 좋네요~ Dennis 쌤께 PT받고있는데 정말 몸짱된거 같아 너무좋아요~ Dennis쌤 적극 추천합니다~~,"2년째 다니는데 골프, 헬스, 유산소, GX 등 적당한 헬스장. 고층이고 깨끗해서 좋음",코로나 위기를 잘 견뎌내줘서 고마워요,혼자 헬스만 다니다가 처음으로 PT받고 있는데 생각보다 힘들지만 재밌어서 운동을 더 꾸준히 다니게 만드네용! 데이빗 팀장님 보고 있으시다면 미리 사죄드려요 사실 어제 식단 안먹고 치킨먹었어요ㅜㅠ,처음 왔는데 일단 직원분들께서 친절하게 맞이해주시고 상담도 잘 해주셨구요~ 건물 자체랑 시설도 너무 깔끔하고 깨끗했습니다 확실히 지은지 얼마 안된곳이라서 최첨단(?)인것 같아여~지문인식으로 입장한다고 하셨는데 안전하게 즐기면서 운동할 수 있을 것 같아서 넘 기대되네요 ㅎㅎ가격도 이정도면 정말 싼 편이고 코로나로 인해 다른 사람들과 운동할때 ㅠㅠ땀나 침튀기거나 이럴 걱정도 없이 샤워방도 다 칸막이가 있어서 그게 제일 인상 깊었습니다 ㅎㅎ 좋은 헬스장 알게되서 넘 좋네여 ㅎㅎ아ㅜ여긴 정말 탁 트인 골프연습장도 있더라구여ㅠㅠ 골프가 있는 헬스장 처음이에여ㅠㅠ넘 신기했고 배우고 싶게 만들더라구요 ㅎㅎ열심히 운동해서 다이어트 성공하겠습니다 감사합니다 ㅎㅎ,"선생님들이 친절하시고 내부구조도 알차고 좋습니다 ^^... 
지상이다보니 탁 트여서 더 기분 좋게 운동할 수 있을거 같네요 ^^ ㅎㅎ","시설깔끔하고 좋네여♡.♡ 
처음가는분들은 길 잃어버리지 않도록 
잘 알아보고 가세여-☆ 
??한번 와보니 별거 아니긴해요 희희",테크노마트 큰건물 12층에 있다보니 갑갑하지도 않고 좋아요,"시설 깨끗하고 다들 친절해서 좋네요!!ㅋㅋㅋㅋ
탕이 없는건... 아쉽지만 그래도 저는 만족합니다!!ㅎ",David 팀장님한테 PT받고 있어요~ 항상 어깨랑 목이 아팠는데 운동하고 부터는 통증도 많이 없어지고 체력도 좋아졌어요?? 센터도 지상이라 운동하기도 쾌적합니다.,"헬스장 깨끗하고
비용도 저렴해서 가성비 정말 좋네요","시설이 정말 깨끗하네요
생각보다 커서 깜짝놀랐네요
헬스장과 야외골프연습장 한번에 즐길 수 있어서 너무 좋네요!!",시설 좋아요,깔끔하고 다들 친절하세요. 주차는 두시간 무료~,앞으로 운동은 여기서해야될거가타요!시설굿분위기굿~~^^,,,,,,,,,,,,,,
