idx,cnt,review1,review2,review3,review4,review5,review6,review7,review8,review9,review10,review11,review12,review13,review14,review15,review16,review17,review18,review19,review20,review21,review22,review23,review24,review25,review26,review27,review28,review29,review30,review31,review32,review33,review34,review35,review36,review37,review38,review39,review40,review41,review42,review43,review44,review45,review46,review47,review48,review49,review50
84,50,선생님께서 꼼꼼히 상담해주시고 친절하고 열정적이십니다,"바프 준비 할려고 ! 센터 상담 갔는데 
대표님께서 상담부터 꼼꼼하게 체크해주시고 
은진쌤 연결 해주셨어요 :) 여기 저기 강남에서 pt 많이 받아봤지만 이렇게 꼼꼼하고 완벽한 케어는 처음 받아봐요 !!! 언제나 친절한 정스짐 쌤들도 항상 감사해요 ????????","모든 선생님께서 갈 때마다 먼저 다가와서 인사해주시고 2층에 위치하고 있어서 쾌적하고 밝은 곳이라 맘에 들었어요-! 황근상 트레이너쌤께 수업을 받았는데 수업시간 뿐만 아니라 개인운동을 하고 있을 때도 티칭 해주셨어요??
이벤트도 가끔 진행해서 더 재밌게 운동한거 같아요! 운동에 재미를 붙이게 해준 정스짐 넘넘 좋아요????","시설도 깔끔하고 다들 친절하세요!
저의 상황에 맞게 꼼꼼하게 체크해주시고 상담해주시는 모습과 다른분들 운동하는걸 봐주시는 모습들이 믿음이 가네요 ㅎㅎ","강사진분들이 항상 친절하게 인사해주십니다. 최초 상담받을때부터 시작해서 쭉 같은 태도로 친절햐게 지도해 주십니다. Pt도 회원이 원하는 방향으로, 부상당하지 않게 잘 지도해 주십니다. 센터도 매일 청소하시는지, 기구 및 샤워실 상태가 매우 청결합니다.",시설 깔끔하고 선생님들 친절해요 샤워실도 1인 샤워실이라 편하고 깔끔해요 수업도 체계적이고 꼼꼼해요 특히 정석균 선생님 추천합니다 살 확실히 빼주십니다..??,"5월 초 부터 지금까지 20회를 향해 꾸준히 수업받고 있는 20대 중반 직장인 입니다!

오양일 트레이너님께 수업을 받고 있으며,
주 2-3회 트레이닝을 받고있습니다!

운동에 운자도 몰랐던 저는 지방밖에 없던 88kg대에서 시작하여 현재는 그래도 은근히 근육이 보이는 81kg 까지 아무런 부상없이 왔어요!

모든건 정스짐과 트레이너님의 체계적인 시스템덕분에 이루어낼 수 있었던것이라 생각하고 있어요!

주기적인 식단체크 및 피드백 그리고 컨디션을 체크 해주시고 최적의 트레이닝을 해주시며,
처음 4kg 덤벨도 낑낑대던 저에게 칭찬도 끊임없이 해주셔서 힘도 낼 수 있었어요!

시설도 깨끗하고 항상 먼저 인사 해주셔서 항상 기분좋게 운동 할 수있고, 초보자도 쉽게 할 수있도록 잘 설명도 해주셔서 정말 좋습니다!","김은진 선생님께 PT받고 있습니다. 
결론부터 말하면 정말 최고입니다!

다른 곳에서 운동할때는 안가고 싶고 결석할때도 많았는데 정스짐은 가서 운동하는게 너무 즐겁고 자꾸 자꾸 가고싶은 PT샵이에요. ?????♀??????♀?

거기에는 첫번째로 항상 모든 선생님께서 친절하게 인사를 해주시는 따뜻함이 있고?? 두번째로 정말로 쾌적한 환경 그리고 무엇보다 저에게 완전히 집중해주시는 트레이너 선생님들이 계시기 때문입니다! 티칭, 식단 관리, 개인 운동까지 신경써주시는데 이렇게 꼼꼼한 곳이 더 있을까 싶을 정도입니다ㅜㅜ 

저는 너무너무 만족하고 감사하면서 운동하고 있고 계속 정스짐에서 운동할거예요^__^ 

항상 신경써주시는 저희 선생님 그리고 다른 선생님들도 모두 감사합니다????","친구 추천으로 다니게된 정스짐이에요! 
우선 짐 자체가 깔끔하고 무엇보다 개인 샤워실이 있어서 너무 좋습니당ㅠㅠ
예전에는 기구쓰는 법이 낯설어서 헬스장에서 유산소만 했었는데 pt받은 후에는 기구도 쓰면서 운동하니까 너무 재밌어요??트레이너 쌤도 체계적으로 세심하게 운동알려주셔서 좋아요!
앞으로도 잘 부탁드립니다 쌤:)","구의동에서 가장 인테리어 깔끔하고 친절한 PT샵..??
심지어 훈남훈녀 트레이너 쌤들이 부담없게 관심 가득히 지도해드리는게 인상적..??
초심자나 꾸준히 운동하려는 분들께 추천입니다.",2층에 위치하고 있는 정스짐! 시설이 너무 깔끔하고 환기가 잘되고 있어서 요즘같은 상황에 꼭 필수조건을 잘 충족하고 있는것 같아요!! 특히 저희 선생님께서 저의 몸을 분석 후 지도해주셔서 작심삼일 다이어트가 이제는 평생 다이어트로 습관이 바뀔 수 있게 가르쳐줍니다! 10회정도 한 상황에서 아직 운동을 포기하지 않은게 신기할정도로 수업이 알차고 재미있어요! 기계는 전부 DRAX로 구성되어있고 깔끔한 블랙으로 맞춰져있어서 운동 효과 2배입니다. 지금 혹시나 피티샵을 고민중이라면 구의 정스짐 최고인것 같아요! 다른선생님들도 너무 친절하셔서 운동할 맛 납니당^_^,"처음 받아보는 피티인데 다들 너무 친절하시고 회원맞춤 운동에 수업때마다 최선을 다해주시는 모습이 너무좋습니다!ㅎㅎ시설은 또 얼마나 깨끗한지.. 내땀이 시설을 더럽히는 느낌ㅠㅠ 헬스장에 들어올때부터의 회원응대부터 상담, 수업들까지 20회 PT를 받는동안 시간과 돈이 아깝지 않은곳이네요. 모든분들에게 자신있게 추천해줄 수 있는 피티샵입니다??",시설도 깨끗하고 너무 친절해요^^~~~,"김수진쌤에게 피티 받고 있어요~지난번 30회 등록이 끝나 이번엔 더 연장해서 6개월치 등록했습니다! 
개인 성향과 몸 상태에 맞게 관리해주셔서 편하게 운동하고 있습니다!

정스짐 트레이너 쌤들 모두 친절하시고 열정이 넘쳐요!
2층에 있어서 환기도 잘되고 밝아서 좋아요??????","역시 정스짐!
여름맞이 대박????","항상 밝은 인사로 맞아주시는 정스짐! 운동 시작을 기분 좋게 할 수 있어요. 쾌적한 환경과 개인 샤워실도 정스짐만의 장점이랍니다. 

오양일 선생님께 PT 받고 있는데요. 꼼꼼한 자세 티칭과 더불어 신체에 대한 해부학적 지식도 많으셔서 좋아요. 덕분에 재밌게 운동하고 있습니다! ????????????

피티레슨 고민하시는 분들께 추천하고 싶어요!????","제친구랑 저랑 같이 피티받으면서 다니는데 트레이너분들도 다들 친절하시고 꼼꼼하게 잘 알려주세요 ??
앞으로도 열심히 다니면서 살빼겠습니당ㅎ","인생 헬스장을 찾은 것 같아요??
PT도 여러번 해봣는데 이렇게까지 친절하고 성심성의껏 알려주시는 곳은 처음 ㅠㅠ
증말로다가 너무 감격스럽고 집주변에 요런 헬스장이 있어서 진짜 동네방네 소리치고 자랑하고 다니고 싶을정듀 !!!
시국이 시국인지라 항상 환기는 물론 바로바로 소독하시는 모습보고 더 신뢰가 가더라구요??
시설도 너무 깨끗하고 샤워실도 깔끔 그자체!!
무엇보다도 운동하러 올 때마다 쌤들이 반갑게 맞이해주시는게 감사할 따름.. 
이제 5회차인데 비포애프터 보니까 변화된 모습이 명확하게 보여서 제 멘토인 은진쌤한테 넘넘 감사드려여??",코로나 때문에 큰 헬스장 가는 것이 망설여졌는데 운동하는 회원이 적어 편하게 운동 가능합니다! PT선생님분들께서 매번 친절하게 인사해주셔서 감사합니다 ????,"운동한지는 조금됐지만 발전이 없는듯하여
PT등록하게 되었는데 이곳저곳 비교하면서 등록한곳이 정스짐입니다?? 상담도 친절하시고 시설도 깔끔하며 무엇보다 운동을 정말 잘 알려주셔서
만족하면서 다니고 있습니다??",처음 방문했을때 아무것도 모르던 사람에게 자세하게 안해도 해주시고 OT진행하면서 정확히 파악해서 알려주시던 점들이 좋아서 등록하게 됐습니다. 후에 진행된 수업에서도 사실 할 때는 정말... 정말 너무 힘들지만 그래도 잘 알려주시고 정확한 자세도 안내해주셔서 다치지 않고 운동 진행할 수 있었고 목표하는 몸매와 무게까지 만들어나갈 수 있었습니다. 운동 진짜 열심히 하고 싶으신 분들께 꼭 추천드려요!♡♡,"피티샵은 처음인데 생각보다 넓고 쾌적해서 놀랐어요! 선생님들도 친절하시고 인사를 너무 잘해주세요!! 
수업도 체계적으로 해주시는것 같아 등록 잘한것
같아요!! 센터가 지상에 있어 안심하고 운동 할수 있어 좋아요?? 
소독도 엄청 열심히 하시는것 같더라구요!","조용석쌤 첫 상담때부터 꼼꼼하고 친절하게 알려주셔서 믿음직한 모습에 바로 결제 했습니다!!! 
다른곳은 등록하면 방치해두는곳이 많은데 ,
정스짐 용석쌤은 식단관리부터 자세 , 방법등 하나하나 알려주셔서 너무 감사해요?? 진짜 이렇게 친절하신분은 처음이에요 !!! 샵도 쳥결해서 코시국에 맘편히 운동할수있어서 좋아요 :) 정스짐 용석쌤 완전 추천드려요 후회없는선택!!!!",친절하게 상담해주셨습니다!,"전체적으로 너무 깔끔하고 방역수칙이 잘 지켜져서 좋았습니다. (쾌적한 환경)
트레이너님들이 세심하고 친절하게 알려주셔서 좋았습니다.
특히 시간낭비 없는 트레이닝을 한거 같아서 보람차고 계속 수업 받고 싶은 욕구가 생기네요.","요즘같은 민감한 시기에 방역수칙도 잘지켜주시고 특히, 1인 샤워시설이 너무 좋았습니다.
선생님들이 정기적으로 CS교육 받으신다고 들었는데 친절하게 알려주시면서 세심하고 꼼꼼하게 자세, 식단을 알려주셔서 다이어트 성공에 한걸음 다가갈 수 있었습니다.
선생님들이 어떻게 하면 회원들이 좀 더 운동에 재미를 느낄수 있을까 하는 고민을 하셔서 항상 보기 좋고 감사하네요.","자세,식단 엄청 꼼꼼하게 봐주시고 몸에 맞게끔 프로그램 짜주세요 운동초본데 엄청 도움 많이됩니다 
시설도 깔끔하고 2층에 항상 창문 열어놓고 환기계속해주셔서 안심하고 다니는중이예요 트레이너님들도 진짜 다 친절하세요 ~ 

운동 일지도 매일 엄청 꼼꼼하게 작성해서(그림까지!!) 보내주세요. 운동초보라 혼자 운동할때 자세나 용어가 기억 안나는 경우가 많은데 개인 운동할때 엄청 많이 도움돼요 ??????
운동 시작하면서 식단이 제일 막막했는데 식단 보내면 꼼꼼하게 피드백 해주시고 아무튼 은진 트레이너님 진짜 강추 ㅠㅠㅠㅠ????????????리뷰 이렇게 길게 써본적 처음입니당..진짜 만족해서 남기는 후기….","PT를 처음 받아봐서 여기저기 많이 알아보고 다녔는데 상담 때부터 여기다 싶어서 등록했어요 :) 일단 센터가 지상이라 밝아서 좋았구요, 관리를 잘 해주셔서 아주 쾌적하고 환기랑 소독도 수시로 해주세요. 헬스 초보라 기구 이름은 잘 모르지만ㅋㅋㅋ 다양하고 깨끗해요! 트레이너 선생님들도 모두 친절하시고 열정적이신 것 같아요~ 저는 황근상 선생님께 수업 받고 있는데 처음에 체형이나 자세 점검으로 시작해서 제가 어느 곳에 신경써야 하는지 잘 알려주세요. 그리고 운동하면서 부족한 부분 잡아주시고 잘 가르쳐주셔서 제 부족한 힘으로도 효과도 많이 보고 재미있게 다니고 있어요.ㅎㅎ 개인 상황이나 스케줄에 맞게 잘 배려해주셔서 무리 없이 다니고 있답니다.ㅎ 글자수 제한 없으면 더 말할 수 있는데 아쉽네여ㅠㅠ 완전 추천추천!","지인추천으로 등록했는데, 일단 시설 깔끔하게 관리가 잘되어 있어서 좋았어요
여러군데 다녀봤지만 제일 좋다고 느꼈어용!
PT도 등록해서 다녔었고, PT선생님은 황근상 선생님이셨는데!! 상담부터 수업까지 굉장히 친절하게 해주셨어요!! 근래 허리랑 어깨가 안좋았는데도 그런곳에 무리 가지않게 적절하게 알려주고 도와주셔서 PT끝난 지금도 그에 맞춰 운동하고있습니다
PT끝나면 나몰라라하는 분들이 있엇는데 근상쌤은 아니였어요 따로 연락해서 물어봐도 언제나 친절하게 알려주시고 언제든 연락보라고 하십니당!ㅋㅋ
정스짐도 추천 근상쌤 추천드려요!","매회 체계적이고 꼼꼼한 수업으로 그동안 거부감으로 멀리했던 운동에 흥미를 느끼기 시작햇어요!
깔끔한시설에 코시국에 대비한 철저한 방역으로 안심하며 다닐수있고, 모든 선생님들이 정말정말 친절하십니다??
특히 은진쌤의 다정하시면서 열정적인 트레이닝으로 어디에 힘이들어가야하고 이 자세는 어떤 근육을 사용하는지 정확하게 알게되고, 어떤점을 고쳐야하는지 자세하게 설명해주실뿐만 아니라 매번 수업후 운동일지를 보내주셔서 혼자 운동할때도 어려움없이 할수잇엇어요??
수업외에도 식단관리도 해주시면서 왜 단백질이 중요한지 친절하게 설명해주셔서 얕게 알고잇던 잘못된 지식을 바로잡고 더욱 건강에 관심을 갖게되는거같아요??
운동하면서 의무감이 아닌 내 건강에 스스로 관심을 갖게되는건 정스짐이 처음인것같네요 최고최고??","헬스장이 엄청 깨끗하고 좋아요 기구도 많이 있고 그리고 제가 헬린이 인데 기구 사용법도 친절하게 잘 가르쳐 주시고 너무 좋았어요
그리고 근상쌤이 너무 잘해주셔서 운동 할사람 있으면 100번 200번 정스짐 추천하고 근상쌤 강추 하고싶어요 코로나 시국에 소독도 잘되있고 너무 만족입니다","집주변으로 피티샵을 알아보다가 상담받고 등록했는데 가격때문에 혼자 헬스를 하는게 나을지 고민했던게 무색하게 너무 마음에 들어요??

선생님들도 쏘 친절하신데다가, 일때문에 수업을 못받아서 아쉬웠는데, 최대한 시간 조정해주시니까 기분 좋게 수업을 시작하게 돼요 키키
운동하는동안 어디에 자극이 들어가야하는지 알려주시고 자세가 틀어질때 왜 그런지 알려주니까 혼자운동하면서 잘못했던 부분도 인지하게되고, 특히!!! 수업후에 운동일지를 보내주시는데 그거 참고하니까 수업없는날 혼자 운동하기 너무 좋아요??????

10번 정도 수업을 받고 리뷰를 남기는데
수업을 받으면서 아쉬움을 느낀건 수업을 받을수 있는날이 줄어든다는거 뿐입니다,,,(세상아쉽????)

리뷰이벤트도 귀찮아서 안하는데 너무 좋아서 리뷰남겨요????","직장 다니면서 체력적인 문제가 느껴져서 필라테스와 헬스를 고민하던 중 시설이 깔끔해 보여서 방문하게 되었습니다:). 
인바디를 측정해보니 체중 대비 체지방은 늘고, 근육량은 너무 떨어져 있는 상태여서..ㅠㅠ 기대반 걱정반으로 운동을 시작했어요. 제가 헬린이여서 트레이너님과 1:1로 잘 할 수 있을까 걱정도 되고 모르는 부분이 많았는데 트레이너님을 잘 만난덕에 지금은 기초 대사량도 팍팍 올랐답니다. 무엇보다 바디라인이 확 달라졌어요!???????? 제 몸에서 어느 부분이 부족한지 자세는 어떤 부분이 잘못된건지 항상 잘 체크해주시고 이끌어주시는 황근상트레이너님 정말 감사해요~~트레이너님 만나기 전 후 바디차이가 확실해서 여기저기 정말 추천하고 있어요ㅠㅠ굿굿! 정스짐 2022년에 새해 복 많이 받으세요??","정스짐 다닌지 3달 정도 된거 같은데
친절하시고 운동 뿐만이 아니라 근육을 이해하시고 스트레칭 및 교정도 함께 진행해 주셔서 너무 마음에 들어요 코로나 시국이라 방역도 철저히 하시고 깨끗해요 황** 트레이너님 항상 감사 합니다","최근에 이사오면서 근처 헬스장 찾던 중 알게 되었어요~ 처음 상담할때 부터 근상쌤 인상도 선하시고 상담도 꼼꼼히 해주셔서 믿음이가서 바로 등록 했네요. 혼자 유튜브 보면서 나름 꾸준히 운동을 했었는데, PT를 받으니 완전 새로운 자극이 느껴져서 신세계 였습니다ㅋㅋ 이래서 전문가에게 배워야 하나봐요ㅜ PT꾸준히 받아서 원하는 목표치까지 열심히 해봐야겠어요. 잘 부탁 드립니다 근상쌤!??",코로나 때문에 운동 쉬었던터라 깨끗하고 공간 관리 잘 되는 곳 찾다가 정스짐 다니게 됐어요~~ 2층이라 환기도 잘되고 개방감 있어서 운동할 때 답답함이 적어서 좋아요. 또 개별 탈의/샤워실 있는 것도 장점이고요. 트레이너분들도 운동 잘 알려주시고 친절하셔용??,"내돈내산 솔직 리뷰
트레이너님이 정말 친절하시고 운동을 잘봐주셔서 편하게 운동에만 집중할 수 있어요. 그리고 인터넷에 너무 많은 정보들이 있어서 헷갈릴때 여쭤보면 정확한 지식을 알려주십니다. 
오픈한지 얼마 되지 않은 곳이라 시설은 깨끗하구요 운동하고 있을때 트레이너분들께서 수시로 소독하시는거 보면 위생에 신경을 많이 쓰시는거 같아요. 집 근처에 PT샵이 많았는데 잘 결정했다는 생각이 들어요~","대학가기전에몸을 만들고싶어서 인터넷을 찾다가 알아낸 정스짐, 시설도 깔끔하고 퀘적하며 1:1pt로 자세교정및 스트레칭방법이나 식단조절도 책입져주십니다! 모든 다이어터 화이팅!!????","선생님도 친절하시고, 시설도 너무 좋네요~~~",링피트로 혼자서 운동하다가 자세를 정확히 모르겠어서 피티받기 시작했는데 무리가 가지않게 자세도 잘 알려주시고 인바디도 주기적으로 측정하다보니 몸상태도 잘 알 수있어서 좋았어요. 트레이너분들도 다 친절하시고 집 근처라 다니기도 편하네요.,태어나서 처음 해보는 피티라 꼼꼼히 알아보고 등록했는데 굉장히 만족합니당~시설이 굉장히 깨끗하고 트레이너쌤들 모두 친절하세요. 운동 배우고 나서부턴 스스로 주5일 운동을 하러 갑니다. 이거부터가 헬린이에겐 엄청난 발전^^.. 설명도 잘해주시고 자세도 꼼꼼히 봐주시는덕에 열심히 출첵합니다 근상쌤 최고????,"센터가 깔끔하고 지상에 있어서 항상 쾌적해요.
트레이너별 큰 편차없이 체계적인 수업을 위해 노력하시는 것 같고 무리해서 수업을 진행하지 않는 점이 넘 좋아욤. 몸이 안 좋을때 오히려 트레이너쌤이 쉬는 게 좋을 것 같다고 해주시니 맘 불편하지 않게 회복 후 다시 수업 받을 수 있었던 것 같아요.
첫 상담도 친절하게 오티 진행해주시니 부담없이 방문해보세요,,ㅎ","올초부터 몸무게도 늘어나고 
체형교정도 필요해서 방문하게되었는데
집에서도 가깝고 무엇보다 다이어트와같이 체형교정도 봐주셔서 좋았습니다",선생님 지도가 군더더기 없이 깔끔하고 상담 또한 너무 매끄럽고 편하게 진행되었습니다. 시설 관리 또한 너무 깔끔해 쾌적한 운동이 가능했어요 번창하시면 좋겠어요!!,깔끔하고 좋습니다 지인소개로 등록 했는데 선생님이 잘알려주시네요. 다이어트에 도움이 필요했는데 원하는 방향으로 잘알려줘서 좋았어요 잘 부탁드립니다~~^^,큰일입니다…잠시 가격만 알아보러 들어갔다가 왠걸 너무 찬절하시고 깨끗하니 제가찾던 그런곳이더라구여..뭐 좀 친절해야 다음에오겠습니다 하고 나왔을텐대 상담 받자마자 바로 등록해버럈습니다 시설도 너무조아잉~ 이제부터 열심히 운동할일만 남았네요! 원래 리뷰 이런거 안쓰는 상남자지만 수업받고 뭐 여태받아본 수업중 으뜸이었습니다 그래서 이렇게 감동받아서 이렇게 리뷰 씁니다 뭐 더잘봐달란뜻은 아닙니다 ㅋ 앞으로도 잘부탁드립니다!,출산 후 몸관리가 필요하다는 생각에 이리저리 알아보고 고민하다가 상담받았는데 친절하게 상담해주시고 꼼꼼하게 살펴봐주시는거같아서 등록했어요:) 앞으로도 잘부탁드려요!,다른 곳에 비해 시설이 매우 깨끗한 것이 맘에 드네요 샤워시설도 좋구요 편하게 운동할 수 있어서 너무 좋았고 지도 선생님들은 알기쉽게 운동을 알려주셔서 더 열심히 하게 되네요! 번창하세요~!,"오늘도 쇠질하고 갑니다.
코로나로 인해 정말 정말 고심끝에 후회없는
선택한거 같아요.
정쌤 쇠질 렛츠고?????♂?","지인추천으로 들린곳이에요! 
상담 한번만으로 비용이 아깝지않다라는 생각이들어서 바로 등록햇어요! 

체형,체력에 맞춰서 운동강도 조절해서 수업해주시고 
너무좋아요! 

그리구 시설이 일단 너무 깔끔 쾌적해요! (찐!) 
개인샤워실도잇어서 더좋은거같아요! 

주차지원도 해주고 너무만족입니당!"
85,0,,,,,,,,,,,,,,,,,,,,,,,,,,,,,,,,,,,,,,,,,,,,,,,,,,
86,0,,,,,,,,,,,,,,,,,,,,,,,,,,,,,,,,,,,,,,,,,,,,,,,,,,
87,0,,,,,,,,,,,,,,,,,,,,,,,,,,,,,,,,,,,,,,,,,,,,,,,,,,
88,0,,,,,,,,,,,,,,,,,,,,,,,,,,,,,,,,,,,,,,,,,,,,,,,,,,
89,0,,,,,,,,,,,,,,,,,,,,,,,,,,,,,,,,,,,,,,,,,,,,,,,,,,
90,0,,,,,,,,,,,,,,,,,,,,,,,,,,,,,,,,,,,,,,,,,,,,,,,,,,
