idx,cnt,review1,review2,review3,review4,review5,review6,review7,review8,review9,review10,review11,review12,review13,review14,review15,review16,review17,review18,review19,review20,review21,review22,review23,review24,review25,review26,review27,review28,review29,review30,review31,review32,review33,review34,review35,review36,review37,review38,review39,review40,review41,review42,review43,review44,review45,review46,review47,review48,review49,review50
52,40,"타 센터에서 레이쌤한테 PT를 배우다가 따라서 광나루 아레나피트니스로 왔어요~~~ 레이쌤이 되게 꼼꼼하게 부위별로 하나하나 다 나눠서 자극점이랑 그에맞는 운동들도 알려주시고 질문에 답변도 잘해주셔서 운동지식도 차곡차곡 쌓이고 있어요!!?? 헬린이에 한발 짝 다가가고 있습니다!!?? 센터도 넓고 기구들도 되게 다양하고 유산소 종류도 다양해서 운동하기에 너무 좋은거같아요???? ...
내용 더보기","리뷰 보고 상담하러 갔다가 등록하게 됐어요! 일단 접근성이 진짜 중요한데, 광나루역에서 1분도 안 걸리는 곳에 있어서 진짜 가기 편했던 것 같아요. pt 등록 후 윤관장님 수업을 통해서 살이 왜 안 빠지는지에 대해 근본적인 원인에 대해 알 수 있었던 수업 시간이었고, 무조건 단백질 많이 먹고, 유산소 하고, 근력운동 해라는 뻔한 수업이 아닌 내 몸에 맞게끔 운동법을 알려주시고, 기능적 운동을 병행하며 수업을 진행함으로써 단순히 근력의 증가만이 아닌 체형을 고려한 트레이닝을 하고 있기에 요즘 시대에 맞는 운동법이 아닌가 싶었습니다. ㅠㅠ 살 빼려고 왔다가 관장님 덕분에 어깨나 허리 그리고 고관절까지 치료받고 있는 중이랍니다~ 통증으로 고통받고 있는 분들은 병원 말구 아레나 윤관장님을 찾으세요~!~!","한 달 정도 이용했는데요, 이 근방 헬스장 중에서 가장 괜찮은 헬스장 아닌가 싶어요!
일단 주차가 정말 편해요! 가끔 다른 곳 들렀다 운동하러갈 때 부담없이 방문할 수 있어서 좋아요??
운동하시는 분들 인원수도 적당한 것 같아요. 저렴한 헬스장, 최저가에 가까운 헬스장에는 그만큼 사람이 많더라구요ㅠㅠ 기구 기다리고, 복잡해서 운동하기 힘든데 여기는 기구 바로 사용하거나, 차있으면 다른 기구 사용하다 자리 나면 가서 할 수 있는 정도의 회전율을 보입니다.
모든 기구와 시설이 깔끔하게 관리되고있고, 기구 다양해서 좋구요, 사물함도 넉넉해서 좋고, 선생님들 모두 운동 가면 친절하게 맞아주시고, 지나가는 소리로 운동하기 싫다 한마디 했는데 제 담당 쌤이 아니신데도 옆에서 들으시고 상처받으시고 그래욬ㅋㅋㅋㅋ좋아요!","웨이트트레이닝 시작한지 2년차
타 센터에서 레이샘 PT 받다가 따라 왔어요~
레이샘 만나기 전에도 PT를 받았는데 하고 나면 내가 무슨 운동을 했었지… 뭔가 답답함이 있었는데 샘 만나고 부터 몸이 변화되는게 느껴지고 
이해가 쏙쏙 개인운동 할 때도 자연스럽게 할 수 있게 되었어요.
정확한 기구 사용법, 자세, 이론이랑 운동 지식도 알려주셔서 굉장히 이해하기 쉬웠어요.
레이샘은 질문하면 웃으시고ㅋㅋ하나라도 더 알려주셔서 너무 감사해요.
그리고 PT 일지 보고 감동??
.
자차 이동이라 주차 걱정했는데 공간도 넓고 주차할인 되서 좋아요.
기구 시설도 많고 다양하고 청결히 유지가 잘되고 샤워실 깔끔하고 마음에 들어요.
즐겁게 운동하고 있습니다.
다들 매너도 좋으신것 같고 헬스장 전체적인 분위기가 좋네요~??",사진보다 체육관이 넓고 기구가 다양합니다. 청결히 관리도 잘 되어있습니다. 혼자서 살살 운동해보려 시작했는데 어느새 PT를 받고 있네요. 관장님께 지도받고 있는데 굉장히 친절하고 성의가 넘치십니다. 아주 만족스럽게 다니고 있습니다.,"제 기준 광장동에서 가장 좋은 센터예요! 
트레이너쌤,관장님,직원분들 모두 친절하세요! 현재 에릭쌤께 PT 받고있는데, 완전 꼼꼼하게 티칭해주셔서 운동에 재미를 느끼고있습니다:)
그리고 센터에 새로운 기구도 계속들어오고 환경이 점점 더 좋아지고있어서 넘 좋습니다:) 아레나??!!","동네에서 운동 기구 많고 깨끗한 핼스장 찾다가 아레나광나루점 등록했어여!!!동네에 다른 헬스장이랑 비교하면서 알아봤는데 여기가 제일 관리가 잘되어있는 느낌을 받았고 기구들이 다 있어요 진짜 ㅎㅎ그 비싸다는 천국의계단 기구도 두개나 있고 넓어서 좋고 선생님들이 부담스럽지 않게 친절해서 조아유 제가 등운동하는 기구 사용법도 물어봤는데 디테일하게 알려주셨어요
그리고 상담해주는 언니도 친절하고 일년치 끊어서 서비스로 한달더 추가로 받았어요??열심히 다녀볼게용","친구따라 방문했다가 시설 너무좋고 친절해서 헬스 바로 끊어버림ㅋㄷ거기에 PT 까지!!!

데이빗 트레이너쌤에게 상담받고 내 인생 첫 다요트를 하기로 맘먹었!!!??

현실적인 조언은 물론 운동을 체계적으로 세부적으로 가르쳐주시는 모습에 믿음이 딱!!!????
운동이 이렇게 즐거운거였나요^^?

헬스장 시설도 쾌적하고 운동기구도 다양하게 요즘껄로 구비되어 있어서 힙하게 운동가능해요 :)

피트니스아레나 강추강추??","피트니스 아레나 운동하기에 너무 좋은곳
지하철하고도 가깝고 주차도 편리하고무엇보다 기구나센터가 깨끗 깔끔 친절 캐비넷도 엄청많쿠요
샤워시설도 아주잘되어 있어요 저는 운동에 운자도관심없던 사람이었으나 크게 아프고나서 여러단계를 걸쳐 지금에 쌤을 만났습니다 임성?으로시작하는쌤인데 일단 회원하나 잘분석하여 개인 레슨을 너무잘하시고 몸이 엄청 좋아지고체력도 많이 올라갔어요
집에서 무려 50분이나지하철로 센터까지 걸리지만 저만한 쌤을 못찾았기에 아레나광나루까지다닙니다쌤을만나서 병원정기검진 에도 체지방이나 근력이 눈에뜨게 숫자가나타났구요특히 수술후 피검사에서는 많이 좋아졌어요 저는 이쌤이 어딜가든 따라갈거예요 운동에 진심인 이런사람 다시만나기 쉽지않을거같아서요 그래서 건강을 많이 찾았다는게 최고~","체육관도 넓고 운동기구도 좋아요
혼자서 하니까 운동이 잘 안되어서 피티를 받고 있어요
관장님께 지도받고 있는데 운동자세도 정확히 봐주시고 궁금한거 여쭈어봐도 친절하게 알려주셔요
운동전후로 뭉친곳이랑 여기저기 풀어주셔서 좋아요",혼자 홈트랑 식단으로 다이어트 해보려는게 수십번- 번번히 실패해서 큰맘먹고 헬스장과 PT를 끊기로 하고 이 근처 헬스장 6군데 이상은 돌아봤어요 다 상담만 받고 생각해보겠다고 했는데 여긴 온날 바로 등록 했어요 가격도 너무 좋았고 무엇보다 시설이 넓고 깨끗하고 기구도 많고 제일 합리적으로 보였거든요ㅋㅋ 무엇보다 관장님 선생님들 매니저님들이 다 친절하십니다 운동 배울마음이 생기더라구요 앞으로 전 여기 쭈욱 - 목표를 이루는 그날까지!! 구의역에 살지만 수많은 헬스장 다 돌다가 여기까지 다니는 이유는 충분히 있겠죠? 강추 !!,"영수증인증리뷰 처음 써보네요.
너무 꼼꼼하고 친절히 잘 봐주셔서 
금,토에 요새 클럽도 가요 헬스클럽??
레이 선생님 감사합니다????","헬스를 제대로 시작해본건 이번이 처음이었는데 관장님이랑 트레이너 쌤이 너무 친절하게 알려주셔서 좋았습니다. 피티 전에는 근육 풀어주는 마사지도 매번 해주시고, 운동이나 근육 원리도 차근차근 다 알려주세요! 피티 시작 전보다 체력이 훨씬 나아진게 확연하게 눈에 보여요 ㅎㅎ 기구도 전부 깨끗하고 좋아서 이번에 재등록했습니다!","근육량이 적은 상태에서 골프를 배우다 어깨, 목등이 너무 아퍼 찾게되었습니다. 여러곳을 탐방하였으나 제일 깔끔하고 운동기구 종류도 많아 선택하였습니다. 처음 저의 몸상태를 파악하시고 근육 맛사지와 골프에 필요한 근력수업을 진행해 주셨고 더불어 높은 체지방은 식단과 유산소운동을 통해 감량하도록 관리해주시고 근력향상을 위해 웨이트 운동도 체계적으로 지도해주셔서, 오랜만에 보는 지인들이 저를 못알아볼 정도로 몸매도 예쁘게 만들어 주고 계십니다. 처음엔 근력을 키우고 그만 둬야지 했는데 평생 해야겠다는 마음이 들어 6개월 회원권이 종료하자 1년으로 다시 끊었습니다. 항상 성심성의껏 가르쳐주시고 관리해 주시는 관장님과 교정 선생님, 정말정말 감사합니다. 열심히 할게요^^♡ㅋ","기구도 다양하구 !! 유산소 기구 50대는 넘는듯!! 헬스장 시설 ,기구가 너무너무너무 깔끔해요 !! ???? 운동하기 최고??","상담도 친절하게 해주시고, 무엇보다 마음에 들었던 점은 깔끔함이 유지되는 점인 것 같아요! 코로나시국에 다른 곳은 불안해서 못가겠는데 피트니스아레나 광나루점은 맘 놓고 운동할 수 있어 좋습니다 :D 
기구도 다양해서 이만한 헬스장 없는 것 같아요! 대만족입니다????","4년전 신규 오픈 때 부터 이용하고 있습니다.
시설도 좋고, GX 프로그램도 좋고, PT가 다양하고 첵계적입니다.
내 건강을 지키는데 가장 기본이 되는 곳이라서 정말 좋습니다.",광나루 근처 헬스장 많이 다녀봤지만 여기가 최고네요 광나루 아레나 휘트니스 다니면서 프로필 도전해봐야겠어요,"날도풀려서 집근처 헬스장 알아보려고 방문한곳!전체적으로 헬스장규모가 커서그런지 유산소 종류가 엄청많아서 놀람 ㅋㅋㅋ 예전다녔던 헬스장은 천국의계단도 하나뿐이라 시간제한있고 다른유산소도 오래하면 눈치보고그랬던기억이??
여기선 절대 그럴일은 없겠구나 해서 바로 등록
했어용 !!!! 땀복입고 열심히운동해야쥬 ??","가격 대비 시설이 좋구요 
운동 처음 시작하기 딱 좋은 헬스장인 듯요
추천 드립니다??????",상담 해보고 처음으로 믿음이 가는 거 같아서 플렉스 하고 왔습니다!! 열심히 운동해서 몸짱 될게여????,운동기구 사용하는 방법을 꼼꼼하게 잘 알려주시고 운동하는 분위기도 좋아요,기구가 다양하고 런닝머신 개수도 많아요. 여러 구역이 잘 나눠져 있어서 좋았어요.,트레이너 쌤이 자세하게 운동법을 가르쳐주세요!그리고 열정 가득하게 트레이닝해주시고 식단도 매일 챙겨주세요! 다이어트가 안될 수가 없어요!주차장도 엄청 넓고 여유롭습니다.런닝머신도 20대 넘게 있어서 유산소운동도 불편없이 할 수있어요.,좋아요 .,"상담예약하고 갔다가 바로 회원권 등록 했습니다.
센터시설이 깨끗하고 운동하는데 있어서 불편함이 없어 보여요~
기구들마다 투명 가림막도 설치되어있고 곳곳에 소독제도 비치되어있어요.
서비스로 주신 ot 시간이 맘에 듭니다.
회원권 가격도 이정도 사이즈 헬스장이면 꽤 합리적인 가격인것 같아요.",전에 다니던 헬스장보다 다양한 기구가 많아서 새롭구여 그리고 담당 피티쌤인 마린쌤이 자세 및 케어까지 해주셔서 가격대비 만족도가 매우 높은것같아요 그리고 매장 분위기가 젊은느낌나서 더 좋은것같습니다. 교통편도 매우 좋아서 다니기가 편합니다 만족도 굿굿!!???? 센터 청소를 매일 하시는지 늘 쾌적합니다??,열심히 운동하겠습니다!!,집이 아차산 쪽인데 헬스 다니려고 이곳 저곳 다니면 알아보다가 이곳으로 최종 결정 했습니다 ! 제가 헬스장을 찾을 때 중요하게 생각하는 부분이 모두 충족 되어있어 상담받고 바로 1년 등록 했습니다 ! 고민이었던 부분 중 하나가 퇴근하고 바로 차를 타고 와야해서 주차가 불편하면 너무너무 스트레스인데 여기는 주차도 대형 마트 처럼 넓고 편해서 너무 좋았습니다 물론 가장 중요한 헬스장 내부도 깔끔하고 기구도 최신식이라 헬린이도 부담없이 운동할 수 있었고 헬스장 분위기가 모두 열심히 운동만 하는 분위기 입니다. 같이 열심히 해야할 거 같은 분위기..ㅎㅎ 운동하기 딱이에요!! 저도 1년 끊은 거 후회 없이 꾸준히 다니고 있고 원래 리뷰같은 거 잘 안남기는데 여기 다닌 후로 살이 많이 빠져서 한번 남겨봅니다 >_<,"헬스장 정착 못하다가 교통편이랑 시설도 좋고 깨끗해서 헬스장 정착했어요~
설명도 편한 분위기에서 쉽게해주셔서 너무 좋고, 퇴근하고 가도 될만큼 시간대도 여유 있어서 좋아요~",좋아요,깨끗하고 운동하기 좋은 분위기입니다,좋아요,1년 등록! 탈의실이 좀 더 깨끗하게 관리되면 더 좋을 듯해요,광장동 인근에선 제일 시설 좋고 깨끗한듯 합니다??,사물함 비용 결제했어요 .,좋아요,아레나 짱!,운동하기 너무 좋아요,"2018년에 오픈해서 시설은 좋은데,
1월이라 그런가.. 사람대비 공간이 너무 좁아요!
마구잡이로 회원만 많이 안늘린다면,
동네에서 가장 깔끔합니다!",,,,,,,,,,
53,0,,,,,,,,,,,,,,,,,,,,,,,,,,,,,,,,,,,,,,,,,,,,,,,,,,
